pillar,area,item_id,title,detection_source,detection_signal,doctor_check_id,status,reference_url
Security,Identity,ai_lz.AI.102,Disable local (key-based) auth on the Azure OpenAI account [AI.102],azure_resources,account.disable_local_auth == true,waf.security.local_auth_disabled,implemented,https://learn.microsoft.com/azure/well-architected/ai/security
Security,Identity,ai_lz.AI.62,Use Microsoft Entra Auth with Managed Identity instead of API keys [AI.62],azure_resources,"account.identity.type in {SystemAssigned, UserAssigned}",waf.security.managed_identity,implemented,https://learn.microsoft.com/azure/well-architected/ai/security
Security,Network,ai_lz.AI.103,Restrict access to selected virtual networks or use private endpoints [AI.103],azure_resources,account.publicNetworkAccess == Disabled or private endpoint present,waf.security.public_network_access,implemented,https://learn.microsoft.com/azure/well-architected/ai/security
Security,Telemetry,ai_lz.AI.86,Diagnostic logs enabled on Azure AI service resources [AI.86],azure_resources,account has at least one diagnostic setting with a workspace_id,waf.security.diagnostic_settings,implemented,https://learn.microsoft.com/azure/well-architected/ai/security
Security,ContentSafety,ai_lz.AI.52,Content-Safety baseline content filter attached to approved models [AI.52],azure_resources + azure_monitor,no content-filter triggers AND RAI policy attached to deployments,safety.runtime.content_filter,implemented,https://learn.microsoft.com/azure/well-architected/ai/security
Security,ContentSafety,ai_lz.AI.93,Jailbreak / prompt-injection risk detection on the agent prompt [AI.93],foundry_control,LLM scans system prompt for override-phrasing / unbounded role-play,responsible_ai.llm.prompt_jailbreak_surface,implemented,https://learn.microsoft.com/azure/well-architected/ai/security
Security,Authentication,ai_lz.AI.96,Enforce MFA for any user with rights to the Azure environment [AI.96],manual,verified in Entra ID Conditional Access policies,manual.security.mfa_enforcement,manual,https://learn.microsoft.com/azure/well-architected/ai/security
Security,Authentication,ai_lz.AI.97,Enforce Entra ID PIM for zero standing access / least privilege [AI.97],manual,verified in Entra ID PIM role assignments,manual.security.pim_zero_standing_access,manual,https://learn.microsoft.com/azure/well-architected/ai/security
Security,Authentication,ai_lz.AI.98,Enforce Entra ID Conditional Access policies on the workload [AI.98],manual,verified in Entra ID Conditional Access policies,manual.security.conditional_access,manual,https://learn.microsoft.com/azure/well-architected/ai/security
Security,AccessControl,ai_lz.AI.66,Use RBAC to manage data-plane access to Azure OpenAI [AI.66],azure_resources,data-plane role assignments scoped to least privilege,manual.security.rbac_data_plane,manual,https://learn.microsoft.com/azure/well-architected/ai/security
OperationalExcellence,Foundry,ai_lz.AI.130,Enable monitoring for Azure OpenAI / Foundry instances [AI.130],foundry_control,foundry_control.diagnostics.status == ok,opex.no_foundry_control_configured,implemented,https://learn.microsoft.com/azure/well-architected/ai/operations
OperationalExcellence,Foundry,ai_lz.AI.117,Foundry project has at least one published agent [AI.117],foundry_control,foundry.agents is non-empty when source is ok,opex.no_foundry_agents,implemented,https://learn.microsoft.com/azure/well-architected/ai/operations
OperationalExcellence,CI-CD,ai_lz.AI.135,Repository has an AgentOps PR gate (IaC + eval CI) [AI.135],workspace_files,.github/workflows/agentops-pr.yml exists,opex.no_pr_gate,implemented,https://learn.microsoft.com/azure/well-architected/ai/operations
OperationalExcellence,CI-CD,ai_lz.AI.2,Repository has deploy workflows so evals re-run after deployment [AI.2],workspace_files,at least one .github/workflows/agentops-deploy-*.yml exists,opex.no_deploy_workflow,implemented,https://learn.microsoft.com/azure/well-architected/ai/operations
OperationalExcellence,Versioning,ai_lz.AI.128,Agent target pinned to a version (detect model / prompt drift) [AI.128],workspace_files,agentops.yaml agent: <name>:<version>,opex.unpinned_agent,implemented,https://learn.microsoft.com/azure/well-architected/ai/operations
OperationalExcellence,Evaluation,ai_lz.AI.172,Evaluate system with a golden dataset (regression detection) [AI.172],results_history,regression check: latest_metric - baseline_metric > threshold_drop,regression,implemented,https://learn.microsoft.com/azure/well-architected/ai/operations
OperationalExcellence,Evaluation,ai_lz.AI.147,Evaluator bundle covers groundedness / relevance / coherence for the agent [AI.147],workspace_files,LLM judges bundle YAML against agent description,opex.llm.bundle_coverage,implemented,https://learn.microsoft.com/azure/well-architected/ai/operations
OperationalExcellence,Monitoring,ai_lz.AI.132,Monitor token usage to prevent service disruptions [AI.132],azure_monitor,App Insights KQL on gen_ai.usage.* token counts,manual.opex.token_usage_monitoring,planned,https://learn.microsoft.com/azure/well-architected/ai/operations
OperationalExcellence,Monitoring,ai_lz.AI.131,Alerts on critical activity-log events for AI resources [AI.131],azure_monitor,Azure Monitor activity-log alert rules attached,manual.opex.activity_log_alerts,manual,https://learn.microsoft.com/azure/well-architected/ai/operations
OperationalExcellence,Governance,ai_lz.AI.176,Adhere to Azure OpenAI terms of use and allowed use cases [AI.176],manual,documented governance decision,manual.opex.governance_use_case_review,manual,https://learn.microsoft.com/azure/well-architected/ai/operations
Reliability,Telemetry,ai_lz.AI.115,Production telemetry is wired and emitting traces [AI.115],azure_monitor,monitor.status == ok AND request_count > 0 over lookback,errors.no_runtime_telemetry,implemented,https://learn.microsoft.com/azure/well-architected/ai/reliability
Reliability,ErrorRate,ai_lz.AI.9,Production error rate under threshold (retry + healthchecks effective) [AI.9],azure_monitor,errors / requests > rate_threshold over the lookback window,errors.production_rate,implemented,https://learn.microsoft.com/azure/well-architected/ai/reliability
Reliability,FoundryRuns,ai_lz.AI.13,Foundry agent runs not failing [AI.13],foundry_control,foundry.failure_rate > rate_threshold,errors.foundry_runs,implemented,https://learn.microsoft.com/azure/well-architected/ai/reliability
Reliability,Quota,ai_lz.AI.10,Adequate TPM / RPM quotas allocated for the workload [AI.10],azure_monitor + foundry_control,Azure OpenAI usage / quota utilization metrics,manual.reliability.quota_adequacy,planned,https://learn.microsoft.com/azure/well-architected/ai/reliability
Reliability,RateLimits,ai_lz.AI.154,Rate limits configured on model deployments and monitored [AI.154],azure_monitor,App Insights query on 429 responses + AOAI rate-limit headers,manual.reliability.rate_limits,planned,https://learn.microsoft.com/azure/well-architected/ai/reliability
Reliability,PTU,ai_lz.AI.155,Monitor provisioned-throughput utilization (PTU) when applicable [AI.155],azure_monitor,Azure Monitor metric on AOAI provisioned-throughput utilization,manual.reliability.ptu_utilization,planned,https://learn.microsoft.com/azure/well-architected/ai/reliability
Reliability,HighAvailability,ai_lz.AI.158,Cognitive / AI Search: enable 2+ replicas for HA [AI.158],azure_resources,search.replicaCount >= 2,manual.reliability.aisearch_ha_replicas,manual,https://learn.microsoft.com/azure/well-architected/ai/reliability
Reliability,HighAvailability,ai_lz.AI.160,Cognitive / AI Search: leverage Availability Zones [AI.160],azure_resources,search account hosted in an AZ-enabled region,manual.reliability.availability_zones,manual,https://learn.microsoft.com/azure/well-architected/ai/reliability
Reliability,DisasterRecovery,ai_lz.AI.164,Backup / restore strategy for AI Search index [AI.164],manual,documented backup runbook + restore drill,manual.reliability.aisearch_backup,manual,https://learn.microsoft.com/azure/well-architected/ai/reliability
Reliability,DisasterRecovery,ai_lz.AI.7,Multi-region deployment for Azure OpenAI (BCDR) [AI.7],azure_resources,AOAI deployments exist in at least two regions,manual.reliability.multi_region_aoai,manual,https://learn.microsoft.com/azure/well-architected/ai/reliability
Performance,Latency,ai_lz.AI.113,p95 latency under threshold (App Insights + eval history) [AI.113],azure_monitor + results_history,p95_seconds > p95_threshold_seconds,latency,implemented,https://learn.microsoft.com/azure/well-architected/ai/performance-efficiency
Performance,Stability,ai_lz.AI.143,Eval metrics are stable across runs (no flaky judge) [AI.143],results_history,coefficient of variation across last N runs > flaky_cv_threshold,opex.flaky_metric,implemented,https://learn.microsoft.com/azure/well-architected/ai/performance-efficiency
Performance,Freshness,ai_lz.AI.114,Evaluations run regularly enough to surface drift [AI.114],results_history,latest run timestamp older than stale_after_days,opex.stale_evaluation,implemented,https://learn.microsoft.com/azure/well-architected/ai/performance-efficiency
Performance,Throughput,ai_lz.AI.137,Throughput target defined for the workload [AI.137],manual,documented TPM / requests-per-minute target,manual.performance.throughput_target,manual,https://learn.microsoft.com/azure/well-architected/ai/performance-efficiency
Performance,Throughput,ai_lz.AI.140,Benchmark token consumption against estimated demand [AI.140],azure_monitor,Azure Monitor / AOAI benchmark vs expected TPM,manual.performance.token_benchmark,planned,https://learn.microsoft.com/azure/well-architected/ai/performance-efficiency
Performance,ModelChoice,ai_lz.AI.142,Right model selected for the right task (size vs cost tradeoff) [AI.142],manual,model selection rationale documented in spec,manual.performance.model_selection,manual,https://learn.microsoft.com/azure/well-architected/ai/performance-efficiency
Performance,HostingModel,ai_lz.AI.136,PTU vs PAYG decision evaluated for predictable workloads [AI.136],manual,documented hosting-model decision review,manual.performance.ptu_evaluation,manual,https://learn.microsoft.com/azure/well-architected/ai/performance-efficiency
Performance,Latency,ai_lz.AI.138,"Latency optimizations: streaming, token limits, prompt compression [AI.138]",manual,documented latency optimization checklist,manual.performance.latency_optimizations,manual,https://learn.microsoft.com/azure/well-architected/ai/performance-efficiency
Performance,Elasticity,ai_lz.AI.141,Elasticity: PTU + TPM fallback deployment when bursty [AI.141],manual,documented PTU+TPM fallback topology,manual.performance.ptu_tpm_fallback,manual,https://learn.microsoft.com/azure/well-architected/ai/performance-efficiency
Performance,Segregation,ai_lz.AI.139,Synchronous vs batch request segregation by priority [AI.139],manual,documented sync / batch traffic separation,manual.performance.batch_segregation,manual,https://learn.microsoft.com/azure/well-architected/ai/performance-efficiency
Cost,Billing,ai_lz.AI.14,Verify PTU vs PAYG cost savings for the workload pattern [AI.14],manual,documented PTU vs PAYG cost analysis,manual.cost.ptu_vs_payg,manual,https://learn.microsoft.com/azure/well-architected/ai/cost-optimization
Cost,Billing,ai_lz.AI.17,"Use the right deployment type (global vs regional, cost-per-token) [AI.17]",manual,documented deployment-type decision,manual.cost.deployment_type,manual,https://learn.microsoft.com/azure/well-architected/ai/cost-optimization
Cost,Budgets,ai_lz.AI.20,Configure 'Actual' and 'Forecasted' budget alerts in Cost Management [AI.20],manual,Azure Cost Management budget rules in place,manual.cost.budget_alerts,manual,https://learn.microsoft.com/azure/well-architected/ai/cost-optimization
Cost,Tracking,ai_lz.AI.25,Cost tracking by model usage informs model-choice decisions [AI.25],azure_monitor,tagged cost data per model deployment,manual.cost.cost_tracking,planned,https://learn.microsoft.com/azure/well-architected/ai/cost-optimization
Cost,TokenLimits,ai_lz.AI.26,max_tokens limit set on every model deployment / call [AI.26],workspace_files,run.yaml / bundle declares max_tokens,manual.cost.max_tokens_limit,planned,https://learn.microsoft.com/azure/well-architected/ai/cost-optimization
Cost,TokenLimits,ai_lz.AI.33,Concise prompts: minimize prompt + response token sizes [AI.33],manual,prompt review during PR,manual.cost.prompt_compression,manual,https://learn.microsoft.com/azure/well-architected/ai/cost-optimization
Cost,Batching,ai_lz.AI.24,Batch requests to amortize per-call overhead where possible [AI.24],manual,documented batching pattern for high-volume flows,manual.cost.batch_requests,manual,https://learn.microsoft.com/azure/well-architected/ai/cost-optimization
Cost,TokenAnalysis,ai_lz.AI.22,Use tiktoken to size tokens for conversational flows [AI.22],manual,token-sizing utility wired into prompt pipeline,manual.cost.tiktoken_sizing,manual,https://learn.microsoft.com/azure/well-architected/ai/cost-optimization
Cost,Quota,ai_lz.AI.28,Quota management: use dynamic quota when workload allows [AI.28],manual,AOAI quota review / dynamic quota enabled,manual.cost.quota_management,manual,https://learn.microsoft.com/azure/well-architected/ai/cost-optimization
Cost,ModelChoice,ai_lz.AI.30,Start with cheaper base models; escalate only when needed [AI.30],manual,documented model-selection ladder,manual.cost.model_selection_ladder,manual,https://learn.microsoft.com/azure/well-architected/ai/cost-optimization
